i a'a sei ko di'a co'e ma ba la'e do'i fasnu	Aha, go on, what happened next?
a'a cu'i ko denpa lo nu mi mulno zei gasnu ti	Eh, just a second, let me finish this.
a'a nai mi na tirna	La, la, la, I'm not listening.
i a'e pu'o tsunami	There's going to be a tsunami!
a'e ba vlile zei xamsi zei boxna	There's going to be a tsunami!
a'e ba vlile tcima	It's going to be violent weather!
a'e lo cabna zei djedi ba xamgu djedi	Today is going to be a good day!
a'e nai mi ckana zei klama	I'm going to bed.
a'e nai mi klama lo ckana	Yaaaawn... I'm going to bed.
ko sisti lo ka pante	Quit complaining.
i mi ca tatpi i ei mi ca cliva	I'm tired. I've got to go now.
a'i cu'i ti jai frili	Ah, this is easy.
a'o su'o da viska ti	I hope someone sees this.
a'o do ba zi di'a kanro	I hope that you will get well soon.
a'o do kanrze'a ca lo balvi zei lamji zei djedi	I hope you feel better tomorrow.
a'o ko'a ba zi kanro	Hopefully he will be healthy soon.
a'o ko'a ba zi zenba lo ka kanro	I hope he'll get better soon.
a'o la tam gleki	I hope Tom is in a good mood.
a'o lo gusni be bu'u lo jipno be lo kevna zei pluta na se cupra su'o trene poi ca'o muvdu mi	I hope the light at the end of the tunnel is not from the train coming on me.
a'o lo nobli cu gidva lo se zukte be mi	Oh, that the Lord would guide my ways.
a'o mi te dunda su'o karce poi kargu gi'a do'a nai na spofu	Hopefully, I'll be given an expensive car or at least one that isn't broken.
a'o mi xabju lo barda zdani de'i da	I hope to live in a mansion someday.
a'o mi za'u re'u penmi do	I hope to see you again.
a'o nai	I'm hopeless!
a'o nai ro da ca se cirko	Everything will be lost now.
a'o ti tarmi tu'a do	Let this be an example to you.
a'o nai	Oh no!
a'o nai cai	It's hopeless.
a'o nai cai	There's no hope.
a'u cu'i na cuntu mi	That's none of my business.
a'u lo cribe cu vajni lo lojbo zei prenu ma	I'm interested in why bears are important to Lojbanists.
a'u lo ti cumki zei munje zei cfika cu simlu lo ka cinri i e'a pai ca lo nu do fi ri ba'o tcidu cu jbera ri do fa mi	This science fiction story seems interesting. Will you lend it to me when you have finished reading it?
a'u ma ba'o se lifri do	What happened to you?
a'u mu'i ma do mlatu zei cmoni	What compels you to meow?
a'u mu'i ma do mlatu zei cmoni	Why are you meowing?
a'u nai ta panci simsa lo kalci	Yuck, that smells like shit!
a'u cai	How fascinating!
a'u nai do to'e pluka se sumne	You stink.
a bu banzu i je ku'i by na go'i	A is enough, but B is not enough.
ai sai	I'll definitely do that.
ai le'o mi do kanla zei vimcu	I'll gouge out your eyes!
ai mi ciksi ro da pe ta ve cu'u lo uitki	I am going to explain it completely on the wiki.
mi pu'o krixa	I'm going to scream.
ai mi ba mulno ciksi ve cu'u la uikis	I am going to explain it completely on the wiki.
mi pu'o krixa	I'm going to scream.
ai mi pa moi fonxa zei jorne	I'll call first.
ai mi pu'o tcidu le cukta	I've been meaning to read this book.
ai mi te zei nupre zei cpedu tu'a lo pa kumfa	I'd like to reserve a single room.
ai mi troci lo ka cenba	I'll try to change.
ai mi ze'e ba jmive	I intend to live forever.
ai nai mi gunka ca lo pa zei djedi	I'm not planning to work on Monday.
ai nai mi jmina lo valsi poi mi finti	I don't mean to add words of my own devising.
ai penmi do ti'u li cy mu	See you at five.
ai sai mi cpacu se va'u do nu'e cu'i ku'i	I'll do my best to get it for you, but I don't promise anything.
ai e'e	I'll do that without fail.
ai nai pinfu zei gasnu le nanla	We can't put a young boy in prison.
ai pei do klama	Do you come?
au iu mi ba klama ta ca da	I'd love to go there one day.
na mutce lo ka vajni mi ku fa lo du'u ma kau jinga	I don't really care who wins.
au da bloti gi'e se pilno mi lo ka mi fu ce'u klama fi lo zvati zei darno be ti	I want a boat that will take me far away from here.
au flaume pesxu	I'd like some plum jam.
au jadni zei kevna lo mi kerlo	I want to get my ears pierced.
au klama la amerik	I would like to go to America.
au klama la nipon ca da	My dream is to go to Japan someday.
au lo tricu cu krati lo ro se genja je cu sfasa lo kusru be gy	Would that the trees might speak on behalf of all things that have roots, and punish those that wrong them!
au mi bajra	I want to run.
au mi bangu zei tadni lo bandu'e'u	I want to study German.
au mi bangu zei pilno la lojban	I want to speak in Lojban.
au mi ckape zei jundi	I want to be cautious.
au mi cilre	I want to learn.
au mi cilre fi lo jungo zei bangu ca lo balvi zei lamji zei nanca	I want to learn Chinese next year.
au mi cinba do	I want to kiss you.
au mi ciska su'o se cukta	I want to write a book.
au mi citka	I want to eat.
au mi citka su'o da	I'd like to eat something.
au mi cliva	I want to leave.
au mi co'u di'i tadni bu'u lo ckule	I want to leave school.
au mi cpare lo vi barda zei cmana	I want to climb this mountain.
au mi dansu	I want to dance.
au mi djuno ta	That's what I want to know.
au mi gletu ra	I want to have sex with her.
au mi djuno zei gasnu ra lo fatci	I want to tell her the truth.
au mi ko'a tavla	I want to talk to her.
au mi ko'a tavla	I want to talk to him.
au mi no roi se panzi da	I never want to have kids.
au mi se frasbau	I just wish I knew how to speak French.
au mi tavla do	I want to speak with you.
au mi tavla do da poi drata	I want to talk to you about something else.
au mi tavla do lo vi liste	I want to talk to you about this list.
au mi viska do	I'd like to see you.
au mi viska le klaji	I want to see the streets.
au mi viska lo mamta be do	I want to see your mother.
au mi xabju lo tcadu	I want to live in the city.
au mi za'u re'u te vecnu	I want to buy another one.
au na cmila zei frati mi	I don't want to be laughed at.
au nai mi cliva	I'm reluctant to leave.
au nai mi spuda le ra xatra	I do not want to reply to his letter.
au nu do gleki	I wish you happiness.
au pei kelci su'o da	Do you want to play something?
au pikta fi lo ka klama la bostyn	I'd like a ticket to Boston.
mi sipna zei nitcu	I'm sleepy!
mi sipna zei tatpi	I'm sleepy.
au zirpu zei smela pesxu	I'd like some plum jam.
au nai mi ckana zei klama	I don't want to go to bed.
au nai mi klama lo ckule	I don't want to go to school.
au nai mi pinxe lo lenku	I don't want to drink anything cold.
au nai mi tavla do	I don't want to talk to you.
au nai mi tcidu fi lo vi cukta	I don't want to read this book.
au nai mi tirna zei jundi do	I don't want to listen to you.
au pei mi'a vi denpa tu'a do	Shall we wait for you here?
au sai mi klama la misrgu'e	I really want to go to Egypt.
e'a do cliva	You may go.
e'a do limna	You may swim.
e'a do ralte le cukta	You may keep the book.
e'a do zutse zei binxo	You may sit down.
e'a do zukte lo se ckaji zei djica	Do as you want.
e'a la tom cu zukte ro se aidji be ri	Tom may do whatever he wants to.
e'a nai do nenri zei klama	You must not go inside.
e'a nai do ti stali	You can't stay here.
e'a pei mi co'a kansa	Can I join?
e'a pei mi'a do kansa lo ka cadzu zei klama	May we accompany you on your walk?
e'a pei ro'i mi preti zei cusku lo prenu zei srana do	Can I ask you something personal?
e'a do nenri zei klama	Do come in.
e'a nai sai do cliva	I forbid you to leave.
e'a nai do crepu lo xrula	You may not pick the flowers.
e'a pei danmo zei vasxu	May I smoke?
e'a pei mi jbera lo pinsi	Could I borrow a pencil?
e'a pei mi preti zei cusku fi do	May I ask you something?
e'a pei mi tavla la bil	May I speak to Bill?
e'e do lacri mi	You can rely on me.
e'e ko jarco lo se kakne be do	Show them what you can do! Go for it!
e'e mi do bajra jivna fe'e co'u le karce	I'll race you to the car!
e'e mi no zei kansa	I'll be okay by myself.
e'e nai doi kelis	Whoa, Kelly!
e'e nai mi cfila zei facki do lau'u	I can't fault you for that.
e'e nai	I can't.
e'e se'a	I will do it myself.
e'i cai mi do sisti zei gasnu	I've got to stop you.
e'i ko ta mi dunda	Give that to me!
ei mi ckaji zei klama lo ka penmi la tom	I have to go meet with Tom.
ei mi xruti zei dunda lo vi cukta ca lo cabna zei djedi	I have to return this book today.
e'i nai ko zukte lo se djica be do	Do whatever you please!
e'i nai ro roi jetnu zei cusku	You don't have to tell the truth all the time.
ei nai do ti lebna	Feel free to take this.
e'i cu'i lebna ti	Help yourself.
e'o cusku krefu	Please say that again!
e'o do cikre ta	Please fix that.
e'o do denpa i mi troci co to'e cirko fi le vi cukta	Just a minute. I'll see if I can find it in this book.
e'o do di'a cusku lo do lisri	Please go on with your story.
e'o do dunda lo silna mi	Can you pass me the salt, please?
e'o gau do mi viska su'o kacma poi drata	Please show me another camera.
e'o do jukpa lo snuji fi'o te dunda mi	Could you make me a sandwich?
e'o do pinxe lo tcati	Please drink tea.
e'o do bacru masno zenba	Could you talk more slowly, please?
e'o do va'o gi cliva gi ganlgau lo vorme	Please will you close the door when you go out.
e'o do zenba lo ka pu zu co'a sanli ku su'o mentu be li mu	Please stay for 5 more minutes.
e'o do zutse	Please sit down!
e'o ga nai do zifre gi do mi sidju	If you are free, give me a hand.
e'o gau do lo gusni zei tutci co'a akti	Could you turn on the light please?
e'o ko basti zei gasnu fi lo lanci	Change the flag, please.
e'o ko bevri mi fo ti	Please take me away from here!
e'o ko birti le du'u le djacu ku curve	Please make sure the drinking water is pure.
e'o ko ciska lo srana be lo jetnu se lifri be do	Please write about your real experience.
e'o ko co'a dasni lo cutci	Please put on your shoes.
e'o ko co'a dasni lo cutci	Please put your shoes on.
e'o ko cpedu fi la tam fe lo nu jalge fonxa zei jorne mi	Would you ask Tom to call me back, please?
e'o ko curmi lo nu mi ciksi	Please, let me explain.
e'o ko dunda fi mi fe lo blanu zei ckana zei bridi be loi djacu	May I have a glass of water?
e'o ko mi fraxu	I ask that you forgive me.
e'o ko gasnu lo nu co'a gusni	Turn on the light, please.
e'o do djuno zei gasnu mi lo du'u ma kau pluta lo sorpeka tcana	Could you show me the way to the bus stop?
e'o ko jarco tu'a lo pikta be do	Please show your ticket.
e'o ko jinru zei lumci lo cifnu	Please give the baby a bath.
e'o ko kacmterxra fi mi	Would you please take my picture?
e'o ai pei do ti lebna	Could you take this, please?
e'o mi cliva bu'u lo klama zei sisti tcana poi se lidne	Please let me off at the next stop.
e'o ko masno tavla	Please speak slowly.
e'o ko mipri	Please keep it a secret.
e'o ko na djuno zei gasnu	Please don't tell anyone.
e'o do tcidu fi lo valsi zei mei poi cnita	Please read the text below.
e'o ko no da djuno zei gasnu lo du'u mi zvati ma kau	Please don't tell anyone where I am.
e'o do dunda lo silna mi	Please pass me the salt.
e'o ko sanga su'o da	Please sing a song.
e'o ko sidju	Can you help me, please?
e'o ko tavla mi xe cu'u lo fonxa	Please don't hesitate to call.
e'o do tcidu fi lo vi cukta	Please read that book.
e'o ko ti zutse	Please have a seat here.
e'o do mi xruti zei dunda be lo kargu se ponse be mi	Could you give me back my valuables?
e'o ko ve pagre fi mi le silna	Please pass me the salt.
e'o ko vitke fi lo mi jbena zei detri zei nu zei salci	Please attend my birthday party.
e'o do zenba lo ka masno lo ka bacru	Please speak more slowly.
e'a pei mi do kansa	Can I join you?
e'o ko mi gidva lo ka klama lo do jatna	Take me to your leader.
e'o mi surla	I'm going to rest, OK?
e'o mi viska	Let me see it.
e'u do citka su'o lo vi titla zei spisa	Here, have some candy.
e'o re makcu pikta cu co'e	Two adult tickets, please.
e'o ro da zo'u mi nitcu lo ka zukte da i na ja do mi djuno zei gasnu lo du'u go'i	Let me know if I need to make any changes.
e'o va'o lo nu do ganse lo se srera kei ko cikre	If you see a mistake, then please correct it.
e'o do smuni zei cusku la'e di'u se pi'o lo sampu bangu	Could you put it in plain language?
e'o ze'i denpa	Just a minute.
e'u curmi lo nu do jimpe fi da poi tarti e de poi te tarti fi da	Let thy understanding enter into the things that are doing and the things which do them.
e'u do ciska de'u	Please write it down.
e'u do ckire xo'o la djim lo ka gau ce'u do fliba	You have Jim to thank for your failure.
ko na xanka i lo bandu'e'u ta na bangu	Don't worry. She doesn't understand German.
e'a sai do pilno lo mi valsi zei cukta	Please feel free to use my dictionary.
e'u do ze'a surla	I suggest you rest for a while.
e'e mi'o finti su'o bangu pe mi'o i te zu'e bo no drata cu smuni zei jimpe lo se cusku be mi'o	Let's make our own language so no one will know what we're talking about!
pe'i mi'o iancu lo ka gau ce'u jdika lo ka kargu	I think we should reduce the price.
e'u klama fu lo basfa	Let's go by bus.
e'u klama fu lo so'i zei prenu zei karce	Let's go by bus.
e'u do catke lo zunle batke pe lo pe'a zei smacu ja'e lo balvi zei lamji ve pruce	Please press the left mouse button to continue.
e'o do gasnu lo sarcu be lo nu do kufra	Please make yourself comfortable.
e'u ko renro lo bolci mi	Please throw me the ball.
e'u ko rinsa lo do lanzu	Please say hello to your family.
e'u ko vimcu dei	Please delete this sentence.
e'u loi verba cu bartu zei klama je kelci	The children should go outside and play.
e'u ma'a troci	Let's have a try.
e'u mi ciksi se pi'o lo cartu	Let me explain it with a diagram.
e'u mi lanli facki fi lo se kakne be mi'o	Let me see what we can do.
e'u mi'o klama la cinjukus ca lo balvi zei lamji zei djedi cerni	Let's go to Shinjuku tomorrow morning.
e'u mi'o klama lo ra zdani	Let's drop by his house.
e'u mi'o pensi lo xlali zei traji be lo cumki	Let's consider the worst that could happen.
e'u mi'o salci	Let's party!
e'u nai do kalri zei gasnu le moklu	You better not open your mouth.
e'u mu'i lo nu ka'e carvi ku do bevri su'o santa	I think you'd better take an umbrella in case it rains.
e'u se stidi ko'a	Why don't we ask for his advice?
ko'oi mi'o bu'u lo va ckafi zarci cu pinxe su'o ckafi	Let's go drink a cup of coffee at that coffee shop over there.
e'u sai gau do su'o da se ciska notci lo ta nu zukte zei tugni	You really should get this agreement down in writing.
ei cikre lo mi xagri	I need to get my oboe repaired.
ei dai lo prenu ma cinmo se va'o lo nu ri te vecnu	What should a person feel to buy something?
ei do bredi ro da	You have to be prepared for anything.
ei do ca ba'e ti klama lo do zdani	You must go home at once.
ei do ckeji	You ought to be ashamed.
ei do ckeji lo se tarti be do	You should be ashamed of your conduct.
ei do djuno	You ought to know.
ei do jdice lo du'u xu kau do djica lo nu klama	You ought to decide whether or not you want to go.
ei do jundi te zu'e lo nu na ku gau do ra fengu	You must be careful not to make him angry.
ei do kurji lo do bilma mamta	You should take care of your sick mother.
ei do kurji lo verba	You must look after the child.
ei do mi pu smuni zei cusku be lo jetnu	You should have told me the truth.
ei do na jitfa zei cusku su'o da	You must not tell a lie.
ei do pu na zukte su'o simsa	You shouldn't have done such a thing.
ei do pu tirna zei jundi mi	You should have listened to me.
ei do sidju la tom	You should help Tom.
ei do stace lo do pendo	You should be true to your friends.
ei do stodi zei gasnu lo do kumfa lo ka jinsa	You must keep your room clean.
ei do troci bu'u su'o drata	You must try somewhere else.
ei do troci lo nu co'e bu'u lo drata	You must try somewhere else.
ei do xenru	You should be sorry.
ei do zukte lo se bilga be do	You must perform your duty.
ei do zvati zei stodi ti	You are to stay here.
ei dunda lo djacu lo xrula purdi	The flower garden needs watering.
ei ko'a na cliva pu lo nu ba'o cikre lo junla	I can't let them leave before the watch is fixed.
ei lo jatna cu ckeji	The president ought to be ashamed.
ei lo mi skami su'o da pilno zei xamgu	My computer has got to be useful for something.
ei lo prenu cu marde zei stace gi'e nai marde zei stace bai	A man should be upright, not kept upright.
ei lo verba ku tinbe fi lo vo'a rirni	Children should obey their parents.
nitcu lo ka se lumci	It needs washing.
ei ma'a cliva	We should leave.
ei ma'a klama	We must go.
ei ma'a kurji loi me ma'a laldo	We must provide for our old age.
ei mi bredi zei gasnu mi lo cipra	I have to prepare for the test.
ei mi ca di'a gunka	I should go back to work now.
ei mi ckana zei klama	I have to go to bed.
ei mi cliva co'o	Gotta go now, bye!
ei mi cliva co'o	I should go now. Bye!
ei mi klama lo pulji tcana	I have to go to the police station.
ei mi klama lo zdani	I should go home.
ei mi na curmi ti	I can't permit this.
ei mi sabji lo djacu lo xrula	I have to water the flowers.
ei mi te vecnu lo cnino skiji	I must buy new skis.
ei mi'a klama	We must go.
ei mi'o bredi ro da	We have to be prepared for anything.
ei ma'a ba zi casnu	We need to chat soon.
na sarcu fa lo nu do fraxu zei cpedu	You don't have to make an apology.
ei nai do ckape zei cinmo	You don't have to feel threatened.
do nitcu lo po'o ka klama ta	The only thing you need to do is go there.
ai sai mi jinga	I have to win.
ei nai klama ca lo balvi zei lamji zei djedi	It's not necessary to come tomorrow.
i a'o do di'a mulno kanro	I hope you will be completely cured.
i e'o do te lisri tu'a ko'a ca lo balvi zei lamji zei djedi a'u sai ui a'o se'i nai ro'i	Hey, could you tell a story about it tomorrow? I'm very interested, and I hope you can.
i e'o do zukte na ku ta	Would you mind not doing that?
i e'o ko ciska lo cmene be do fo lo pinsi	Write down your name with a pencil, please.
i e'o ko kalri zei gasnu lo canko	Please open the window.
ei do co'a ti muvdu su'o mikce	It is necessary for you to see a doctor at once.
ei mi klama lo ckana	I have to go to bed.
oi ro'e ki'u ma pau nai lo nu bacru zo galxe nandu mutce va'o lo nu galxe bilma	Stupid brain! Why is saying 'galxe' so very difficult with a sore throat?
i oi pei da'i mi do kansa	You mind if I join you?
do'a y so'u va'e lo ka pilno zei xamgu	Broadly construed, it's, uh, slightly useful.
i ba'u cu'i mi bai cliva	To be precise, I go, because I am forced to.
i bi'u mi terpa lo nu klama fu lo vinji	Now, it so happens that I'm afraid of flying.
i bu'u lo tricu va lo mitre be li mu cu mlatu	There is a cat five meters from the tree.
i ca sipna zei kumfa cnici zei gasnu	She's now straightening up her room.
i carvi na ja nai kelci	In the event of rain, the game will not be held.
mi pu clite korcu zei sanli	I bowed politely.
i co'udu'u za'a	They looked relieved.
i da'i dei na'e xajmi se ja'e da'i lo nu na'e ranxi	This sentence wouldn't be funny if not for irony.
i da'i mi va'o lo nu mi ponse rau jdima cu pu te vecnu lo dakli	If I had had enough money, I would have bought the bag.
i de'u na nuzba	This isn't news.
i djuno lo du'u la djan pu prami vo'a	She knows that John loved her.
i do ba zi sisti lo ka pensi tu'a ko'a	You will soon cease to think of her.
i do bilga lo nu pilno lo palku kei ni'i nai lo za'i do nanmu	Your being obliged to wear pants doesn't logically follow from the state of your being a man.
i do darxi mi se ri'a lo za'i mi cortu	You hit me, which results in my pain.
do mutce lo ka certu lo ka kelci la starkraft	You play Starcraft really well.
i do na bebna	You're really not stupid.
i do nenri sau tu'a le ckiku valsi	You enter, with the key word being a requirement.
i do preti zei cusku mu'i ma	Why do you ask?
i do se prami mi	I love you.
do tavla fi ma ua nai	What are you talking about?!
i fau lo nu mi sanli binxo kei mi cusku le se du'u mo'u citka	While standing up, I say that the eating is over.
i fa po'o lo ka prami jo'u lo ka gleki cu se cinmo bu'u la skatland i lo ka xebni jo'u lo ka to'e ckire zo'u mo pau dai i nu'o ti'erna su'o srana i nu'o ti'erna	There is only love and happiness in Scatland. Hatred and resentment? Well that's unheard of. It's unheard of.
i ge mikce gi ji'a te cukta	In addition to being a doctor, he is a writer.
i gunka fi'o pe'a simsa lo bifce	They worked like bees.
i ie la alis zvati da'i ca lo purci zei lamji zei djedi i je ku'i mi'a na viska a bu	Alice might have been there yesterday, but we didn't see her.
i jitfa	Wrong.
ka'e valsi sisku ja'e lo nu cpacu lo xe fanva i ku'i na mulno lo ka lo'e zei ckaji lo ka valsi zei cukta	You can search words, and get translations. But it's not exactly a typical dictionary.
ta ka'e bai co'u se jibri ca lo balvi zei lamji zei masti	She may have to quit her job next month.
i ka'u so'a remna su'o da xebni i ku'i mi mutce lo ka denpa zei tsali	Almost all men hate something, but I am very good at being patient.
i ke'u mi pu terpa	As earlier mentioned, I was afraid.
i ki'u ma do cusku zo co'o	Why do you say goodbye?
i ki'u ma do tai stati tu'a lo fraso zei bangu	Why is your French so good?
i e'e ko cikna	Come on, wake up.
i ko joi mi ca citka i mi xagji sai	Let's eat now. I'm starving.
i ko djuno zei gasnu le do rirni lo du'u mi rinsa	Remember me to your parents.
i ko mi tavla zo'e na ku ca ku i ca ba'e ri do iancu lo ka cusku su'o da	Don't come to me now with that. You should have said something when it originally happened.
i ko na jundi la tom	Ignore Tom.
ko su'o da mi preti zei cusku	Ask me a question.
ko cu'uxna su'o da fo lo ka se zukte la kris	Select action for Chris.
ko'a pu ku tatpi gi'e ku'i stodi lo ka gunka	She was tired, but she kept working.
i ku'i mi'o zvati ma	But where are we?
i la platon cu morsi zei binxo ni'i le du'u py remna	Plato dies, which follows logically because he is human.
i la tam pu tinbe fi mi	Tom did what I told him to do.
i la ba'e tam jukpa lo vanci sanmi	Tom was the one who cooked dinner.
i la pitr pu mikce binxo djica	Peter wanted to become a doctor.
i la tam kakne co sanga su'o lo fraso	Tom can sing a few French songs.
ro da poi la meris cu gasnu ke'a zo'u la tom ra da fraxu to'e ri'a nai da	Tom always forgives Mary, no matter what she does.
la tom pu kucli lo du'u xu kau nandu da'i fa lo ka bu'u la bostyn co'a se jibri	Tom wondered whether it would be hard to find a job in Boston.
i le bolci cu farlu ri'a lo nu mi co'u sarji ri	The ball fell because I stopped holding it up.
i le li'i clupa nu casnu bau ro da ja'e no de cu rinka	The experience of a looping discussion in all languages which results in nothing is the cause.
lo sfaile cu baitni li xa gei ze	The file is weighing 7 megabytes.
i le'o cu'i do na bredi lo nu casnu lo kagni kei poi pilno zei xamgu	No worries, you aren't ready to talk about the company, which is useful.
je'u lo jdini cu pelji a'u cu'i i je ta karce je ba'e dacti	You know, money is just paper, and that is a real car.
i li'a mi na viska ro marna pilno i ku'i lo zasni nu bebna cu se rinka lo nu pilno lo marna i ro prenu cu djuno la'e di'u	Of course, I haven't seen all marijuana users. But marijuana use causes temporary stupidity. Everyone knows that.
i le bolci pu janli pa kanla be le bi'u nai fetsi	The ball hit her in the eye.
i lo bruna be mi na se mansa lo se ponse be pu zi co'a ku karce	My brother is not satisfied with his new car.
i lo cmene be do cu za'a xelso	I see that you have a Greek name.
i lo'e jeftu cu djedi li ze	A week has seven days.
lo kagni cu djica lo nu ri jdini ricfu zenba	The company was in want of money.
catke lo flira be vo'a lo canko blaci pe lo zarci	He pressed his face against the shop window.
kukte ko	Have a nice meal!
i lo mabla kanpe cu cusku lu i mi na ricfu li'u i lo zabna kanpe cu cusku lu i mi na'e ca ricfu li'u	Pessimists say 'I'm not rich.' Optimists say 'I'm not rich at the moment.'
i lo malba pe lo minji cedra na se krasi lo minji cedra ku sa'e	The agonies of the machine age do not originate from the machines as such.
i lo mamta be do cu xanka lo do ni kanro	Your mother is anxious about your health.
i lo mensi be mi ca xabju la boston ja'e lo nu la'a mi vitke fi lo se diklo	My sister lives in Boston, hence, I'll likely visit the area.
i le mi pa lanka cu culno za'u cukta	My basket is full of books.
ze'a lo cabna zei jibni mi jdika lo ka lo se viska cu satci	My vision is getting worse these days.
i lo mitre be li re zo'u pluta zei ni zei clani fi lo tcana	The station is two meters away.
i lo mlatu cu zukte co tunta be fa lo jgalu lo mi xance	The cat dug its claws into my hand.
i lo nanmu e lo ninmu e lo verba ca ca'o citka	The man is eating. The woman is eating. The child is eating.
lo troci be lo ka bebna cu bebna	Those who try to be foolish are foolish.
lo xabju be lo blaci dinju cu iancu lo ka renro no rokci	Those who live in glass houses should not throw stones.
i le nu le bi'u nai nakni ba fliba cu lakne	He will probably fail.
i lo nu stace na ro roi te prali i tcaci zo'e ne lo munje	Honesty does not always pay. Such is the way of the world.
lo mi patfu pu ta'e cusku lo se du'u lo cevni cu sidju ro da poi sidju da	My father always said that heaven helps those who help themselves.
i lo porto zei gugde cu na'e jai natfe zei mupli	Portugal is not an exception.
i lo prenu cu jinvi co se rarna lo nu tivni	We take it for granted that television exists.
i le se cpedu be do cu fenki	Your demands are unreasonable.
i lo sonci cu se pluka lo ckape je lo nu zei kelci gi'e se mu'i bo nelci lo ninmu ku noi jai ckape zei traji co se kelci	The soldier enjoys game and danger, and that is why he enjoys women who are the most dangerous of playthings.
i lo troci ku po'o snada i ku'i lo troci po'o ku fliba	Only the one who tries succeeds. But the one who only tries fails.
lo verba pu ckaji zei jibni lo ka jauvasmro	The child was almost drowned.
lo nu mi jo'u la tal pu zi casnu cu mukti mi lo ka preti zei cusku fi do i pe'i lo'e mlatu lo'e gerku cu zmadu lo ka vrusi kukte i ie pei	Me and Tal's recent discussion prompted me to ask you. I expect cats to taste better than dogs. Agree?
i le bi'u nai fetsi pu ze'a le cacra be li so'i ru'i klaku	She cried for hours without ceasing.
i ma krasi lo munje	What is the origin of the universe?
i ma krinu	What's the reason?
i ma pu rinka lo nu ue do ka'e vasxu se ri'a nai lo ka morsi zei binxo vau je se pi'o nai lo vacri lumci cabra	What caused you to be able to breathe without dying and without using an air-cleaner?
i ma traji lo ka jai nandu kei lo ro bangu	Of all languages, what's the most difficult?
i melbi cmene do	You have a beautiful name.
