mi sisku tu'a za'u pendo vi ku	I'm searching for friends here.
mi sisti	I quit.
mi skicu lo judri do ca ga lo cabna zei djedi gi lo balvi zei lamji zei djedi	I'll give you the address either today or tomorrow.
mi smadi lo nu la tom pu klama le zdani	I guess Tom went home.
mi simsa zei tarti lo ka gunka	I pretended to work.
mi snada	I have succeeded in doing it.
mi snanu lo berti	I am south of the north.
mi snuti penmi ra bu'u lo tcana be lo so'i zei prenu zei karce	I met her by accident at the bus stop.
mi so'e roi klama lo ckana ti'u li re pa	I usually go to bed at nine.
mi so'e roi citka lo cmalu cerni zei sanmi	I usually have a light breakfast.
mi so'i roi cortu lo runtrango	I sometimes have pain in my stomach.
mi so'i re'u litru	I travel a lot.
mi so'i sai roi tavla fau lo nu mi sipna	I talk in my sleep very often.
mi so'i va'e ckire do lo ba'o se zukte be do	Thank you very much for all you have done.
mi sorta gleki	I'm sort of happy.
mi sorta lo ka gleki	I'm sort of happy.
mi speni da gi'e se panzi re de	I am married and have two children.
mi speni zei sisti	I am divorced.
mi srera	I made a mistake.
mi stagcti	I am a vegetarian.
mi stali le zdani ca lo cabna zei djedi	I will stay home today.
mi stali lo ta xotli	I'm staying at that hotel.
mi stici lo stuna	I am west of the east.
mi stidi lo nu mi'o se gidva ko'a	Let's follow his advice.
mi stuna lo stici	I'm to the east of the west.
mi sumne da poi cazfusra	I smell something rotten.
mi surla lo nu mi tavla	I had a relaxing talk.
mi surla lo nu mi tavla	I relax myself by talking.
mi surla lo nu mi tavla	I'm having a relaxing talk.
mi sutra bajra	I run quickly.
mi ta'e limna pa roi ro jeftu	I swim once a week.
mi ta'e pilno lo na'e zei danmo zei tanko se ba'i lo sigja mu'i lo nu kanro	I habitually use smokeless tobacco as substitute for cigarettes because of health reasons.
mi ta'e pinxe loi ckafi	I drink coffee.
mi ta'e re zei xislu zei marce zei klama lo briju be mi	I bike to work.
mi ta'e tcidu	I often read.
mi ta'e nai catlu lo se tivni	I sometimes watch TV.
mi tadni	I am a student.
mi tadni	I study.
mi tadni bu'u la ma'ucu'e be la aksfrd	I am a student at Oxford University.
mi tadni la lojban	I study Lojban.
mi tadni lo bangenugu e lo banjupunu	I study English and Japanese.
mi tadni lo frasbangu	I'm studying French.
mi tadni lo glico zei bangu	I'm studying English.
mi tadni lo glico zei bangu bu'u lo ckule	I study English at school.
mi tai sepli zei cinmo	I feel so lonely.
mi taske	I am thirsty.
mi taske	I'm thirsty.
mi tatpi	I'm tired.
mi tatpi i mi ca nitcu lo nu cliva	I'm tired. I've got to go now.
mi tatpi da bi'u cu'i	I'm tired of this.
mi tatpi gi'e djica lo ka sipna	I am tired and I want to go to bed.
mi tatpi i je ai mi vreta	I'm tired. I'm going to lie down.
mi tatpi lo nu ciska	I'm tired of writing.
mi tatpi lo nu do za'u roi pante	I'm tired of your complaints.
mi tatpi lo nu fanva	I'm tired of translating.
mi tatpi lo tivni	I'm tired of TV.
mi tatpi zenba	I'm getting tired.
mi tavla do	I talk to you.
mi tavla do ti	I talk to you about this.
mi tavla fi lo cinfo	I talked about lions.
mi tavla fi lo vi penbi e nai lo va co'e poi cpana lo jubme	I'm talking about this pen, not that one over there on the desk.
mi tavla fo la lojban	I speak Lojban.
mi tavla fo lo spano	I speak Spanish.
mi tavla ra ca lo purci zei lamji zei nicte	I spoke to her last night.
mi tcati nelci	I like tea.
mi mutce zei xagji ca lo cabna zei djedi	I'm very hungry today.
mi tcidu dei	I am reading this sentence.
mi tcidu fi lo za'u cukta	I read some books.
mi tcidu fi vo cnino cukta	I read four new books.
mi tcidu lo cukta ca lo pu zi nicte	I read a book last night.
mi tcidu lo cusku ca lo purci zei lamji zei nicte	I read a book last night.
mi tcidu lo pemci te cu'u le lanzu be mi	I read the poem for my family.
mi tcidu lo pemci te cu'u le panzi be mi	I read the poem for my child.
mi te benji lo xatra le mi pendo	I received a letter from my friend.
mi te bilma kafke	I have a cough.
mi te citka zei platu i mi djuno zei djica le jei lo nu citka be lo cakla cu rinka lo nu plana	I'm on a diet and would like to know if chocolate makes you fat.
mi te minra mi i mi na nelci lo ve minra	I looked at myself in the mirror and I didn't like what I saw.
mi te mukti	I'm motivated.
mi te mukti lo ka se zei cecla zei morsi zei gasnu ra	I'm gonna shoot him.
mi te mukti zo'e noi mi djica	I will what I want.
mi te preti fo ta de'i li pa	I will ask him tomorrow.
mi te sidbo fi da	I have an idea.
mi te simlu lo ka zo'e mi mipri zei zgana	It seems to me that someone is spying on me.
mi te vecnu lo vi cukta ca lo purci zei lamji zei djedi	I bought this book yesterday.
mi te benji lo xatra be bau la glico zei bangu ca le purci zei lamji zei djedi	I received a letter written in English yesterday.
mi te mukti lo ka jai clira	I plan on being early.
mi te mukti lo ka jinga	I plan on winning.
mi te mukti lo ka klama co zutse	I'm going to go sit down.
mi te mukti lo ka limna	I'm going to swim.
mi te zei nupre zei cpedu	I have a reservation.
mi terpa do	You're scaring me.
mi terpa la'e di'u	I fear so.
mi terpa lo nu cinmo zei xrani do	I am afraid of offending you.
mi terpa lo nu farlu	I'm afraid to fall.
mi terpa lo nu morsi na ja morsi zei binxo	I do not fear death, but dying.
mi terpa tu'a lo cilce danlu	I'm afraid of wild animals.
mi te vecnu ei loi xrula fi'o se dunda le mi prami zei pendo	I have to buy flowers for my girlfriend.
mi ti ca'o xabju co'a pu za lo nanca be li ci	I have been living here for three years.
mi ti co'e ca lo mi zifre temci	This is what I do in my spare time.
mi tinbe le platu le so'i zei gugde zei turni	I'm following the plans made by congress.
mi tinbe le se stidi	I accept this proposal.
mi tirna do	I can hear you.
mi tirna do po'o	I hear only you.
mi tirna lo brife	I can hear the wind.
mi tirna lo nu se ne'i stapa	I hear footsteps outside.
mi tirna lo nu zo'e krixa zei cusku	I heard someone shouting.
mi to'e certu	I'm not good at this.
mi to'e djica lo nu se cuntu	I don't want to get involved.
mi to'e nelci lo ckafi	I dislike coffee.
mi to'e nelci lo cmaci i se mu'i nai mi tadni ei lo nu zei dugri	Although I didn't like math, I had to study logarithms.
mi to'e ri'a nai ra snada	Despite that I succeeded.
mi to'e se pluka lo nu krixa zei cusku fi mi	I do not like to be yelled at!
mi to'e srana ko'a	I have nothing to do with them.
mi to'e cando	I'm busy.
mi to'e citno le nu mi tatpi	I'm an experienced fogey in tiredness.
mi to'e zei citno zei zmadu do	I'm older than you.
mi to'e curmi lo nu do cliva	I forbid you to leave.
mi to'e curmi lo nu do danmo zei vasxu	I forbid you to smoke.
mi to'e curmi lo bi'u nai ckape zei funca	I'm not willing to take that risk.
mi to'e junri lo nu le do mamta pu cusku ma kau	I don't care what your mother said.
mi to'e melbi	I'm ugly.
mi to'e morji lo fonxa zei judri be do	I forget your phone number.
mi to'e morji lo fonxa zei judri be do	I forget your telephone number.
mi to'e morji lo fonxa zei judri be do	I forgot your phone number.
mi to'e morji lo fonxa zei judri be do	I've forgotten your number.
mi to'e morji lo ka sazri zei sisti le ve zei tivni zei vidni kei pu lo nu mi ckana zei klama	I forgot to turn off the television before going to bed.
mi to'e sanji da poi mi pu denpa	I don't know what I was expecting.
mi to'e taske	I am quenched.
mi to'e taske	I am unthirsty.
mi to'e taske	I'm not thirsty.
mi to'e taske	My thirst is quenched.
mi to'e mutce djuno fi la ceikspir	I know a little about Shakespeare.
mi to'e xagji	I am full.
mi to'e lazni gunka	I'm a hard worker.
mi tordu	I'm short.
mi traji	I am the best.
mi traji	I'm the best.
mi traji lo ka lazni kei lo prenu poi mi se slabu	I am the laziest person I know.
mi traji troci gi'e ku'i fliba za'u re'u	I tried my best, only to fail again.
mi troci	I try.
mi troci co klama le zarci le zdani	I try to go to the market from the house.
mi troci lo du'u certu zei binxo lo ka pilno lo katnmruli	I'm trying to become an expert in using axes.
mi troci lo du'u ko'a co'u simxu zei damba noi ku'i na'e frili	I tried to stop their quarrel, but that was not easy.
mi troci lo ka daspo lo dacti se pi'o lo pe mi menli ku po'o	I try to destroy an object using just my mind.
mi troci lo nu mi cilre fi lo bangenugu	I am trying to learn English.
mi tu'a do ja'a ru'e tirna	I can hardly hear you.
mi tunba zei prami do	I love you like a brother.
mi tugni	I agree.
mi tugni da'i	I'd agree.
mi tugni fi lo du'u mi pu srera	I admit that I made a mistake.
mi vasxu zei bilma	I have a cold.
mi ve ckule mu'i lo nu mi ckaji zei djica lo ka cilre	I go to school because I want to learn.
mi vedli	I remember it.
mi vedli lo nu mi pu viska ma kau	I remember what I saw.
mi vedli na je morji lo nu la lenin pu pilno la termenvoks ca lo nanca be li 1920	I remember that Lenin listened to theremin in 1920 (but of course I wasn't there in person at that time).
mi vedli tu'a lo vi zgike	I remember this music.
mi venfu djica	I want vengeance.
mi verba nai i ko tavla nai mi tai lo nu go'i	I'm not a child. Don't talk to me like I am.
mi vi citka ca ro donri	I eat here every day.
mi vi citka ca ro nicte	I eat there every night.
mi vi denpa lo nu ra klama	I'll wait here until she comes.
mi vi nau doi tom	I'm here now, Tom.
mi vi zvati te zu'e lo ka se zdile	I'm here to have fun.
mi vi zvati te zu'e lo ka stali	I'm here to stay.
mi virnu	I'm brave.
mi viska ko	Be seen by me!
mi viska ko	Show yourself!
mi viska la bil vi lo cukta zei sorcu ca lo purci zei lamji zei djedi	I saw Bill in the library yesterday.
mi viska la iumis ca'o lo mi nu senva	I saw Yumi in my dream.
mi viska la liz ca lo cerni be lo cabna zei djedi	I saw Liz this morning.
mi viska la tam	I see Tom.
mi viska la djeimyz pu zi	I have seen James recently.
mi viska la liz ca lo zi cerni	I saw Liz this morning.
mi viska le cukta	I see the book.
mi viska le gerku	I see the dog.
mi viska le prenu poi prami ko	Show me the person who loves you.
mi viska lo cukta	I see a book.
mi viska lo fu'e ia blanu zdani fu'o ponse	I see the owner of what I believe to be a blue house.
mi viska lo melbi cipni	I saw a beautiful bird.
mi viska lo ninmu poi dasni lo xekri	I see a woman wearing black.
mi viska lo nobli zei nanmu e lo nobli zei ninmu	I see a gentleman and a lady.
mi viska lo nobli zei nanmu e lo nobli zei ninmu	I see a nobleman and a noblewoman.
mi viska lo nobli zei nanmu e lo nobli zei ninmu	I see noblemen and noblewomen.
mi viska lo nu do xu kansa la tom va lo rirxe	Was that you I saw with Tom near the river?
mi viska no da	I don't see anything.
mi vitke ko'a i ku'i ko'a na zvati lo zdani be vo'a	I visited her, but she was not home.
mi vitke ko'a i ku'i ko'a na zvati lo zdani be vo'a	I'm visiting her; however, she is not at her house.
mi vitke ra i ku'i ri na zvati le zdani	I visited her, but she was not home.
mi vitke zi'o lo cmalu zei tcadu poi ve jbena fo ra	I visited the village where he was born.
mi vo'a mipri ni'a lo jubme	I hid under the table.
mi volve ba zi	I will be back soon.
mi xa'o jai lerci	I am already late.
mi xabju ka'ai lo mi onkle	I live with my uncle.
mi xabju la amerik	I live in America.
mi xabju la katar	I live in Qatar.
mi xabju la atenais	I live in Athens.
mi xabju la bemro zei joi zei ketco	I live in America.
mi xabju la bemro zei joi zei ketco	I'm from America.
mi xabju la merko zei gugde	I'm from America.
mi xabju la ponjo zei gugde	I live in Japan.
mi xabju lo tcadu	I live in the city.
mi xabju ne'a le xamsi i ja'e bo mi cafne klama le korbi	I live near the sea so I often go to the beach.
mi xabju ti poi zdani	This is the house where I live.
mi xabju ti xotli	I live in this hotel.
mi xabni lo ka speni no da	I hate being single.
mi xadni zei gunka	I practice sports.
mi xagji	I am hungry.
mi xagji	I feel hungry.
mi xagji	I'm hungry!
mi xagji	I'm hungry.
mi xagji sai	I'm starving!
mi xalka zei bebna	I'm drunk.
mi xalka zei bebna na'e ruble	I'm pretty drunk.
mi xamgu kakne ra pe pu za ku	I'm good at that.
mi xamgu kakne ra pe pu zi ku	I'm good at this.
mi xamsi se jmive zei pruce i mi so'i roi lifri lo nu lindi zei vlile zei tcima i mi djuno lo su'u ba zi morsi	I have lived my life on the sea. I have been through many a storm. I know what it is to be within a step of death — ay, nearer than a step.
mi xance te cpacu fi la tom fe lo dakfu	I handed Tom a knife.
mi xanka lo ni do kanro	I am concerned for your health.
mi xanka so'i roi	I do a lot of worrying.
mi xebni do	I hate you.
mi xebni gi'e ku'i to'e jitro se trina	I hate it, yet I'm uncontrollably drawn to it.
mi xebni la tom ki'u zo'e	I hate Tom because reasons.
mi xebni le munje mu'i le du'u le munje cu xebni mi	I hate the world because the world hates me.
mi xebni le za'u valsi	I hate these words.
mi xebni lo bakri i oi punji lo purmo lo xance	I hate chalk. It leaves powder on your hands.
mi xebni lo ckafi	I hate coffee.
mi xebni lo dunra	I hate winter.
mi xebni lo ka denpa tai zo'e bi'u nai	I hate waiting like this.
mi xebni lo ka gunka	I hate working.
mi xebni lo ka laldo	I hate being old.
mi xebni lo ka zgana lo nu do tai co'e	I hate seeing you like this.
mi xebni lo ka'orta	I hate carrots.
mi xebni lo mi jibri	I hate my job.
mi xebni lo nu zgana ro nu do se tasmi lo simsa	I hate seeing you like this.
mi xebni lo pulji poi simsa ra	I hate policemen like him.
mi xebni lo rirni be mi	I hate my parents.
mi xebni lo tamca	I hate tomatoes.
i mi xebni lo'e verba	I hate children.
mi xebni lo'e se sitna zei cusku i ko djuno zei gasnu mi lo poi'i ba'e do djuno	I hate quotations. Tell me what you know.
mi xebni loi pe mi kanla zei mebri zei kerfa	I hate my eyebrows.
mi xebni lo nu so'i prenu cu zvati	I hate it when there are a lot of people.
mi xebni ro da pe la tom	I hate everything about Tom.
mi xebni ro lo jutsi be lo insekto	I hate insects of all kinds.
mi xebni ro lo re do	I hate you both.
mi xebni ro nu do damba	I hate it when you fight.
mi xebni ro da soi vo'a	I hate everyone, and everyone hates me.
mi xendo	I'm fair.
mi xenru lo ka na pu tinbe lo se stidi be lo pe mi mikce	I regret not having taken my doctor's advice.
mi xenru lo nu mi do djuno zei gasnu	I regret that I told you.
mi xenru zei cusku zei djica	I'd like to apologize.
mi xo'i pi'o lo forca	I use the fork.
i mi xriso nixli	I am a Christian girl.
i mi xriso ninmu	I am a Christian woman.
mi xruti zei klama lo bemro zei joi zei ketco	I'm going back to America.
mi xruti lo cukta lo cukta zei sorcu	I returned the book to the library.
mi xusra lo du'u se kukte lo ti plise ku kei ku	I say that this apple is delicious.
mi za'o jai sarcu fai lo ka citka lo cerni sanmi	I still need to eat breakfast.
mi za'o jinvi lo du'u la internet na mapti lo verba	I still believe the Internet is not a place for children.
mi za'o jinvi lo du'u lo kibro na mapti lo verba	I still believe the Internet is not a place for children.
mi za'o jmive	I'm still alive.
mi za'o mutce tatpi	I'm still very tired.
mi za'o na'e sanji tu'a da poi mi ca'o zukte	I don't know what I'm doing yet.
mi za'u re'u co'a speni	I got married again.
mi zasti djica lo nu mi na klama	I really do not want to go.
mi zasti gi ji na'e zasti i ba'e di'u du le preti	To be or not to be, that is the question.
mi zasti gi ji na'e zasti i di'u preti	To be or not to be, that is the question.
i xu mi zasti	Do I exist?
mi zbasu fi lo jdari zei pelji fe ti noi tanxe	I used cardboard to make this box.
mi zbasu le dinju loi mudri	I make the building out of wood.
mi zbasu lo botpi se pu'e lo blaci grana	I make bottles starting with glass rods.
mi zbasu lo botpi soi ve pruce lo nu cpacu lo blaci grana vau ce'o lo nu runme zei gasnu lo grana	I make bottles by the stages of getting glass rods and melting the rods.
i mi stali le zdani	I'm staying home.
mi zdile zei claxu zei cirko	I'm bored.
mi ze'a lo djedi be li so'i na citka	I haven't eaten for days.
mi ze'e pu cpedu do no da	I've never asked you for anything.
mi ze'e pu xebni lo vi stuzi	I've always hated this place.
mi ze'e pu no roi prami do	I have never loved you.
mi ze'e pu no roi te sanga fi ko'a	I never heard him sing.
mi ze'u kucli lo du'u mi lifri da'i ma kau va'o lo nu da'i mi se tunba da	I've always wondered what it'd be like to have siblings.
mi zgana lo nu la tam cu cinba la meris	I saw Tom kiss Mary.
i mi ca ku zgike zei pilno pa cmalu jgita	I play a little guitar.
i mi zgike zei pilno le pipno	I play piano.
mi zi morji lo cmene be ra noi mi ze'a na ka'e morji	I have just remembered his name, which I couldn't for a long time.
mi zi ba'o zdani klama	I've just come home.
mi zi ba'o zdani klama	I've just gotten home.
mi zifre	I'm free.
i mi zifre ca lo cabna zei djedi	I'm free today.
mi zmadu fi lo ka zabna	I'm better.
mi zmadu zei nelci le blanu le xunre	I prefer the blue one over the red one.
mi zmadu zei nelci lo li'i pindi je panpi kei lo li'i ricfu je terpa	I'd rather live in peaceful poverty than in wealth and fear.
mi zmadu zei nelci lo nu no zei kansa klama	I prefer to go alone.
mi zo'u ro da mansa	With me everything is OK.
mi zukte i ki'u bo mi bilga	I do it because I have to.
mi zukte lo se cpedu i jo do mi sidju	I will do it on the condition that you help me.
mi zunle zei xance zei prenu	I'm left-handed.
mi zvati la paris	I am in Paris.
mi zvati le banxa	I'm at the bank.
mi zvati le tcadu	I'm in the city.
mi zvati lo ckule ca lo purci zei lamji zei djedi	I was present at school yesterday.
mi zvati lo nu ganzu penmi kei ca purci zei lamji zei djedi	I attended the meeting yesterday.
mi zvati ma	Where am I?
mi zvati mu'i lo nu snura zei gasnu ko'a	I've come to save her.
mi zvati mu'i lo nu snura zei gasnu ko'a	I've come to save him.
mi zvati mu'i lo nu snura zei gasnu la tam	I've come to save Tom.
mi zvati mu'i lo nu snura zei gasnu lo nobli zei turni zei tixnu	I've come to save the princess.
mi zvati ti te zu'e lo ka snurgau do	I'm here to save you.
mi zvati vi le trentcana	I'm by the train station.
mi'a ba klama vitke do	We'll come and visit you.
i mi'a me la borg	We are the Borg.
mi'a ca denpa tu'a la tom	We are waiting for Tom.
mi'a ca ricfu lo ka te vecnu lo cmalu po'o karce	We can only afford to buy a small car at the moment.
mi'a ca'o klama	We are coming.
i mi'a pu simxu le ka tavla	We talked.
mi'a cliva ei	We need to go.
mi'a cliva xe ka'a lo trene	We left by train.
mi'a dansu ka'ai zu'ai	We dance together.
mi'a djica tu'a lo mulno jufra	We want complete sentences.
mi'a faigau lo prali ro mi'a	We shared the profit among us all.
mi'a gleki	We are happy.
mi'a jimpe	We understand.
mi'a jinru zei sevzi zei lumci ca ro djedi	We take a bath every day.
mi'a jitro ro da	We have everything under control.
mi'a jukpa lo narju zei genja titla zei nanba	We are baking carrot cake.
mi'a ka'e prami je se prami ca zi lo nu jbena	We are all capable of loving and being loved at the moment of our birth.
mi'a kansa do	We are with you.
mi'a klama la xavais ca lo cabna zei vanci	We are leaving for Hawaii tonight.
mi'a klama lo panka mu'i lo nu kelci	We went to the park to play.
mi'a klama lo zarci	We go to the market.
mi'a kucli lo du'u ma kau krinu	We wonder why.
mi'a la kobes la iokoxamas bloti zei klama	We sailed from Yokohama to Kobe.
mi'a du lai borg	We are the Borg.
mi'a mutce xalka zei pinxe	We drank a lot.
mi'a na ka'e sipna ri'a tu'a lo savru	We can't sleep because of the noise.
mi'a na nelci le carvi	We don't like the rain.
mi'a na te cusku lo du'u ko'a klama fi ma kau	We weren't told where he came from.
mi'a nenri lo cukta zei zdani	We are in a library.
mi'a ni'i prami lo jufra i je ku'i zmadu fa lo ni prami lo bangu	So we love sentences. But, even more, we love languages.
mi'a nitcu lo ka casnu	We need to have a talk.
mi'a nitcu lo nu mikce ri	It is necessary that we see a doctor.
mi'a pa'o litru le te gugde lo karce	We traveled around the country by car.
mi'a pagre lo kevna be lo bitmu	We squeezed through a hole in the fence.
mi'a prami zei simxu	We love each other.
mi'a ponse no limna zei lalxu	We don't have a pool.
mi'a pu birti lo du'u lo terdi cu carna lo solri	We were sure the Earth went around the Sun.
mi'a pu ca'o citka lo sovda	We were eating eggs.
mi'a pu casnu so'i zo'e	We talked of many things.
mi'a pu cintpu'i lo zdani lo crino	We painted the house green.
mi'a pu cirko	We lost.
mi'a pu cirko lo farna bu'u lo tricu foldi	We lost our way in the woods.
mi'a pu denpa	We waited.
mi'a pu fraxu zu'ai	We apologized to each other.
mi'a pu je'a se spaji	We were truly surprised.
mi'a pu jinga	We won.
mi'a pu mo	What have we done?
mi'a pu na djica lo nu klama i ku'i mi'a pu bilga lo nu klama	We didn't want to go, but we had to.
mi'a pu na gasnu zei sidju le nu tu cfari	We didn't mean for that to happen.
mi'a pu rupnu zei sarji sidju ko'a	We helped him financially.
mi'a pu simxu zei tavla le mi'a balvi zei cumki	We would often discuss our future.
mi'a pu tavla sa'u zu'ai	We were just talking.
mi'a pu troci	We tried.
mi'a pu viska lo nu lo solri cu cliva lo tsani kei fau lo nu catlu lo ragve be lo canko	We could see the sunset from the window.
mi'a pu viska lo xajmi se tivni	We saw a funny program on TV.
mi'a pu zbasu lo bandu zei dinju lo canre	We made a sand castle.
mi'a pu ze'i gunka zei cliva ca lo jaubeima'i	We had a short vacation in February.
mi'a pu ze'i gunka zei cliva ca lo re zei masti	We had a short vacation in February.
mi'a ralte pa gerku	We have a dog.
mi'a ralte re gerku poi ke'a blabi fa'u xekri	We have two dogs. One is black and the other is white.
mi'a se slabu do	We know you.
mi'a se slabu le zgike	This tune is quite familiar to us all.
mi'a sidju	We'll help.
mi'a simxu zei penmi zei gasnu ri	We introduced ourselves to each other.
mi'a sipna ne'i lo bukpu zei marbi	We slept in a tent.
mi'a sipna zei tatpi	We're sleepy.
mi'a sipna zei nitcu	We're sleepy.
mi'a sipna zei djica	We're sleepy.
mi'a sisku lo ka gleki	We seek happiness.
mi'a stace tavla zei simxu	We had a heart-to-heart talk with each other.
mi'a tadni	We're students.
mi'a tavla sisti mu'i lo nu tirna lo zgike	We stopped talking so that we could hear the music.
mi'a troci	We'll try.
mi'a tugni	We agree.
mi'a vecnu lo jisra be lo narju zei nimre	We sell orange juice.
mi'a vi zvati co ai se zdile	We're here to have fun.
mi'a xabju vi le rentcana	We live close to the station.
mi'a xanla tu'a do	We are worried about you.
mi'a xebni lo vlile	We hate violence.
mi'a xrabo	We are Arabs.
mi'a za'u re'u troci gi'e ku'i na snada	We tried it again, but couldn't do it.
mi'a zvati la paris	We are in Paris.
mi'ai ba cintpu'i ra	We'll paint it.
mi'ai ba vitke do	We will visit you.
mi'ai ba zukte da	We'll do something.
mi'ai ba'o verba	We're no longer children.
mi'ai ba zi djuno lo jetnu	We'll soon know the truth.
mi'ai ca'o jai se bapli fai lo ka mitsisku le pa genxu	We still have to look for the hook.
mi'ai co'i zukte ma	What have we done?
mi'ai co'u se kansa lo rismi	We have no more rice.
mi'ai djica lo ka djuno	We want to know.
mi'ai djica lo ka tavla	We want to talk.
mi'ai djuno	We know.
mi'ai djuno lo du'u do pu zukte ma kau	We know what you did.
mi'ai djuno lo krinu	We know why.
mi'ai djuno lo se jalge	We know why.
mi'ai djuno no da le prenu	We don't know anything about him.
mi'ai e'u klama	Let's go!
mi'ai fraxu le prenu	We forgive him.
mi'ai jai sarcu fai lo ka tavla zu'ai	We need to have a talk.
mi'ai je'a xagji	We really are hungry.
mi'ai ka'e cliva	We can leave.
mi'ai ka'e troci	We can try.
mi'ai krici lo du'u lo nu co'a morsi cu se tcika li re pi'e re no ba lo djedi midju	We believe the time of death was 2:20 p.m.
mi'ai ma zukte ca lo nu do ti mo'u tsuku	What will we do, when you get here?
mi'ai mo	What about us?
mi'ai mo'u cpare lo jipno	We climbed to the top.
mi'ai mo'u tsuku fi'o milxe lerci	We've arrived a little late.
mi'ai na ba mo'u zukte	We're not gonna make it.
mi'ai na ka'e sidju ro da i je ku'i ro da ka'e sidju de	We can't help everyone, but everyone can help someone.
mi'ai na na'e drani	We're not wrong.
mi'ai na pendo	We aren't friends.
mi'ai na pu viska da	We didn't see anything.
mi'ai na se slabu le fetsi	We do not know her.
mi'ai na se slabu le nakni	We do not know him.
mi'ai na te mukti	We aren't going.
mi'ai na zifre lo ka cuxna	We have no choice.
mi'ai na'o te nuzba	We're journalists.
mi'ai nelci da bi'u nai	We love this.
mi'ai no roi pu zukte	We have never done it before.
mi'ai no va'e lo ni sutra	We're in no hurry.
mi'ai pilno lo spano zei bangu po'o bu'u lo zdani	We only use Spanish at home.
mi'ai prane re mei	We were a perfect couple.
mi'ai pu cadzu fi lo jamfu	We went on foot.
mi'ai pu dansu ze'a ro pagbu be lo nicte	We danced all night long.
mi'ai pu jinvi lo du'u xajmi	We thought it was hilarious.
mi'ai pu na terpa	We were not afraid.
mi'ai pu pu'i viska lo snuti	We actually saw the accident.
mi'ai pu snada lo nu ce'u limna be mo'i pa'o le rirxe	We managed to swim across the river.
mi'ai pu tavla zu'ai ca lo purci zei lamji zei djedi	We spoke yesterday.
mi'ai pu viska lo nu ko'a co'i klama lo nenri be lo kumfa	We saw her enter the room.
mi'ai pu za'o mo'u tsuku lo cmana jipno	We finally reached the top of the mountain.
mi'ai ralte ci vinji	We have three planes.
mi'ai ru'i mipri lo nei	We're hiding.
mi'ai se betri	We're in trouble.
mi'ai se ke xamgu jibri	We have good jobs.
mi'ai se panzi re da	We have two children.
mi'ai se pluka sai lo ka citka lo plise	We love eating apples.
mi'ai se urja	We're in a hurry.
mi'ai se rai troci	We try our best.
mi'ai su'ai slabu ze'a lo nanca be li so'i	We've known each other for years.
mi'ai toknjukpa lo cnano nanba	We bake traditional bread.
mi'ai to'e tinsa	We are flexible.
mi'ai xabju vi	We live here.
mi'ai zukte fi da bi'u nai	We aim at that objective.
mi'e farcad	My name is Farshad.
mi'e ivan	My name is Ivan.
mi'e lin	I am Lin.
mi'e sacas	My name is Sasha.
mi'e xeis	My name is Hase.
mi'e xisacis	My name is Hisashi.
mi'e djan doi frank mi cusku lu mi bajra li'u do	I am John, Frank. I tell you “I run”.
mi'e djeimyz i ku'i e'o zo djim cmene mi ko	My name is James, but please call me Jim.
