lo mi bruna goi ko'a cu pu ta'e cikna ca lo nicte i mu'i bo ko'a tcidu lo barda zei cfika	My brother would often stay up all night reading novels.
lo mi citnmau bruna ca'o zgana lo se tivni	My little brother is watching TV.
lo mi cukta dakli cu mutce tilju	My book bag is very heavy.
lo mi cutci cu dukse lo ka cmalu i mi nitcu lo ka cpacu su'oi cnino	My shoes are too small. I need new ones.
lo mi dakfa cu kinli	My knife is sharp.
lo mi dakli cu mutce lo ka tilju	My bag is very heavy.
lo mi famti cu ralte lo gerku	My uncle keeps a dog.
lo mi famti pu dunda lo kacma mi	My uncle gave me a camera.
lo mi famti pu smuni zei cusku fi mi fe lo lisri ne tai lo xajmi	My uncle told me the story by way of a joke.
lo mi fetsi xirma co'a se jbena	My mare foaled.
lo mi fonxa cu se zekri zei lebna	My cellphone has been stolen.
lo mi gerku cu blabi	My dogs are white.
lo mi gerku pu se darxi lo karce	My dog was hit by a car.
lo mi jamfu cu so'o va'e se punli	My feet are a little swollen.
lo mi jdini na banzu	I don't have the money.
lo mi jamfu zei degji co'a ciblu zei cirko	My toe started bleeding.
lo mi junla cu te tcidu lo tcika pe ba za lo mentu be li 5	My clock is five minutes fast.
lo mi junla cu te tcidu lo tcika pe ba za lo mentu be li re	My clock is two minutes fast.
lo mi junla cu zmadu lo do co'e lo ka satci	My watch is more accurate than yours.
lo mi kansa zei junla cu spofu	Something is wrong with my watch.
lo mi kanla cu kalri ca lo nu mi cinba	I kiss with my eyes open.
lo mi karce pu se zei zekri zei lebna ca lo purci zei lamji zei nicte	My car was stolen last night.
lo mi karcckiku ma zvati	Where are my car keys?
lo mi mamta ku jukpa lo titla zei nanba ca lo vi cerni	My mother made cookies this morning.
lo mi mamta na nelci lo nu zgana lo ve tivni	My mother doesn't like watching TV.
lo mi mamta pu katna lo titla zei nanba	My mother cut the cake.
lo mi mensi pu co'a klaku	My sister started crying.
lo mi mlatu co'i catra lo vi smacu	My cat killed this mouse.
lo mi mlatu cu cilmo	My cat is wet.
lo mi mlatu cu morsi zei binxo ca lo purci zei lamji zei djedi	My pet cat died yesterday.
lo mi nakni zei prami cu simlu lo ka junri	My boyfriend seems serious.
lo mi nazbi cu te jetce	I have a runny nose.
lo mi patfu cu kakne lo nu limna i ku'i lo mi mamta na kakne lo nu limna	My father can swim, but my mother can't.
lo mi patfu cu klama lo jungo zei gugde	My father is going to China.
lo mi patfu cu klama lo jungo	My father is going to China.
lo mi patfu cu se tcaci lo ka tcidu lo nuzba zei karni pu lo nu cerni zei sanmi	My father is in the habit of reading the newspaper before breakfast.
lo mi patfu cu zvati lo purdi	My father is in the garden.
lo mi patfu ku na curmi lo nu mi ralte lo gerku	My father won't allow me to keep a dog.
lo mi patfu pu klama lo merko zei gugde	My father has gone to the United States.
lo mi pendo cu skicu mi fo lo ka to'e virnu	My friend called me a coward.
lo mi pelji zei karni ma zvati	Where is my newspaper?
lo mi re zei xislu zei marce ku se zekri zei lebna	My bike is stolen.
lo mi rinsa pu culno pe'a lo ka gleki	My heart was filled with happiness.
lo mi rirni cu na jimpe fi mi	My parents don't understand me.
lo mi se srana ma zvati	Where are my things?
lo mi skami fi mi pendo zei traji	My computer is my best friend.
lo mi tanxe be lo cakla ma zvati	Where's my box of chocolates?
lo mi vacri zei kicne zei lafti zei bloti ku culno lo angila	My hovercraft is full of eels.
lo mi zdani zei dinju cu berti lo tcadu	My house is north of the city.
lo mi'a ctuca cu cusku fi mi'a fe lu ko na cliva lo kumfa li'u	Our teacher said to us, 'Don't leave the room.'
lo mi'a patfu ta'e klama lo briju fu lo karce	Our father goes to work by car.
lo mikce be lo mamta be do cu djica lo nu tavla do	Your mother's doctor wants to talk to you.
lo mikce cu sidju zei cusku lo se du'u mi sisti lo nu bajra ku ki'u tu'a lo dukse sluji zei gunka	The doctor advised me to quit jogging because it was excessive exercise.
lo mikce cu zvati ma	Where is a doctor?
lo mikce pu lacpu lo papri to'o lo me ta daski	The doctor pulled the paper from his pocket.
lo minra blaci cu minra lo gusni	A mirror reflects light.
lo mirli cu se catra loi kalte	The deer was killed by hunters.
lo misno cu xusra lo du'u lo ka se xanri cu vajni zei zmadu lo ka menli zei certu	Someone famous said that imagination is more important than intelligence.
lo jmive zei pruce cu mutce xlali va'o lo nu claxu do	Life's a ruin without you.
lo mlatu cu cpana lo matci	The cat is on the mat.
lo mlatu cu kavbu lo smacu	Cats catch mice.
lo mlatu cu mlatu zei cmoni	The cat meowed.
lo mlatu cu sipna bu'u lo jubme	The cat sleeps on the table.
lo mlatu ku na'e prenu	A cat is not a person!
lo mlatu ku na'e prenu	A cat is not a person.
lo mlatu le jubme cu cpana	A cat was on the table.
lo mlatu pe mi ca lo purci zei lamji zei djedi co'a morsi	My cat died yesterday.
lo mlatu pe mi cu xagji	My cat is hungry.
lo mlatu pu citka lo smacu	The cat ate the mouse.
lo mo'a bi no me la uigur cu zvati la xelvetik	There are only 80 Uyghurs in Switzerland.
lo morji be no da cu gleki	Those are happy, who forget everything.
lo mudri cu fulta	Wood floats.
lo mudri stizu cu kargu	The wooden chair is expensive.
lo munje zei fanmo cu nitcu lo ka denpa	The end of the world will have to wait.
lo mulno ka'e na mo'u mulno gau	What is done cannot be undone.
lo munje cu zdani lo fenki	The world is a den of crazies.
lo munje ga nai da'i se pagbu no ninmu gi mo	What would the world be without women?
lo munje saske cu zmadu lo jikca saske lo ka pluja	The natural sciences are harder than the social sciences.
lo mutce ka zei vlipa cu se kansa lo mutce ka zei fuzme	With great power comes great responsibility.
lo mutce ka zei vlipa cu te binxo lo mutce ka zei fuzme	With great power comes great responsibility.
lo mutce vlipa cu te binxo lo mutce se fuzme	With great power comes great responsibility.
lo na catra be mi'ai cu jai rinka lo nu mi'ai tsali zenba	What doesn't kill us makes us stronger.
lo na se bangu be lo fange cu na se bangu lo me lo nei moi	He who doesn't know foreign languages, doesn't know his own.
lo nanba zei palne cu kukte	The pie is delicious.
lo nakla pu viska lo gerku i ce'o lo bi'u nai verba pu co'a gleki gy	A boy saw a dog. And then this child got happy because of the dog.
lo nakni cu mutce to'e darsi	He's very shy.
lo nakni cu tadni lo banzuxe'o ji'a	He studies Chinese as well.
lo nakni fi ko'a pu carmi zei cpedu lo nu xruti zei klama	He implored her to come back.
lo nakni pu djica lo nu stika zei gasnu	He wanted change.
lo nakni pu gasnu lo nu jadni zei kevna zei rinka lo vo'a nazbi	He got his nose pierced.
lo nakni pu jai jadni zei kevna zei rinka lo pritu kerlo	He got his right ear pierced.
lo nakni pu jai jadni zei kevna zei rinka lo zunle kerlo	He got his left ear pierced.
lo nakni pu nenri zei punji lo vo'a rupnu lo dakli	He put his money in the bag.
lo nakni pu randa zei tugni lo du'u mi drani	He admitted that I was right.
lo nakni pu ti'a na'e darno	He was not far behind.
lo na'e viska va'o se jmina ka'ebi'o lo nu ganse lo nu vi dacti	Blind people sometimes develop a compensatory ability to sense the proximity of objects around them.
lo nanba cu se zbasu fi lo maxri	Bread is made from wheat.
lo nanba cu se zbasu fi lo purmo	Bread is made from flour.
lo nanba cu vifne	The bread is fresh.
lo nanba e loi nu kelci	Bread and games.
lo nanca be li dau cu poi'i lo nu denpa ze'a ke'a cu -dit- zei barda	Ten years is a long time to wait.
lo nanca be li dau cu temci lo purci zei lamji nu mi'o penmi zei simxu	It's been ten years since we last met.
lo nanca cu masti li pa re	A year has twelve months.
lo nanla cifnu cu jbena ko'a	A baby boy was born to them.
lo nanla cu citka lo nanba	The boy eats bread.
lo nanla cu jgari lo verba gerku fo lo cutne	The boy clasped the puppy to his chest.
lo nanla cu tavla simlu lo ka nixli	The boy talks as if he were a girl.
lo nanla ma zvati	Where is the boy?
lo nanla noi va limna cu mo	Who's the boy swimming over there?
lo nanla pu bajra mo'i ne'i lo kumfa	The boy came running into the room.
lo nanla pu citka lo plise	The boy ate the apple.
lo nanla pu renro lo rokci	The boy threw a stone.
lo nanla pu smaji	The boy remained silent.
lo nanla pu smaji	The boy was silent.
lo nanmu cu nitcu lo ka gunka	A man must work.
lo nanmu poi ke'a dasni lo blabi cu pu ca'o zgana do i mi jinvi lo du'u ny nelci do	The guy in white kept on looking at you. I think he likes you.
lo nanmu poi klama ti ca lo purci zei lamji zei djedi ca vi krefu zvati	The same man that came yesterday is here again.
lo nanmu poi se cmene la djordj pu ca'o xabju lo xotli	A man named George was staying at a hotel.
lo nanmu poi xabju lamji mi cu mikce	The man who lives next door to me is a doctor.
lo nanmu pu jibni zei binxo	A man drew near.
lo nanmu pu jorne zei gasnu lo cilta lo cilta	The man connected two wires.
lo nanmu vi zvati	The fellow is here.
lo narju titla zei spisa poi ponjo cu ba'o se nelci zei traji mi	That Japanese orange candy used to be my favorite!
lo nazbi be lo xanto cu clani	An elephant has a long nose.
lo nazbi po'e lo'e gerku cu mutce ganse	A dog's nose is very sensitive.
lo cnebo zei dasri zei jgena cu mapti lo do kosta	The tie goes with your jacket.
lo ni frili cu mleca lo jai se jinvi be lo prenu	It's not as easy as people think.
lo ni lo ponjo verba cu zgana lo ve tivni cu zmadu tu'a lo glico verba	Japanese children watch television more than English children.
lo ni lo vacri cu glare cu banzuni lo nu ro da poi caksova zo'u ga nai de da punji lo karce sefta gi da febvi	It's so hot that you could cook an egg on the hood of a car.
lo ni mi bangu zei certu cu banzuni ge lo so'i tcini gi nai ku'i lo nu cusku tu'a lo mi se cinmo noi xoi cafne cu jai natfe zei sevzi	My fluency is sufficient for many situations, but not for expressing my — often contradictory — emotions.
lo ni mi prami la platon ku no'u li za'u no cu se zmadu lo ni mi prami loi ka jetnu	Plato's my friend, but truth I cherish even more.
lo nicte pu zi cfari	The night is young.
lo ninmu zei selfu cu diklo lo ri ckana	The maid is confined to her bed.
lo ninmu cu cenba zei gasnu lo munje	Women change the world.
lo ninmu cu djica lo nu penmi do	There's a woman as wants to see you.
lo ninmu cu pinxe lo djacu ca ku	The woman drinks water now.
lo ninmu cu pu farlu lo xamsi lo bloti	A woman fell from a ship into the sea.
lo ninmu pe lo bunre kosta cu mo	Who is the woman in the brown coat?
lo ninmu poi dasni lo bunre kosta cu mo	Who is the woman in the brown coat?
lo nixli be se pi'o lo pipno cu me la akikos	The girl playing the piano is Akiko.
lo nixli cu cisma se ga'a mi	The girl smiled at me.
lo nixli cu pu claxu le ka zgike kakne	The girl lacked musical ability.
lo nixli cu te vecnu lo ladru bu'u lo zarci	The girl buys milk at the market.
lo nixli na nelci lo ka kelci lo fudbolo	The girl doesn't like to play soccer.
lo nixli poi sanli bu'u lo vorme cu mo	Who is the girl standing at the door?
lo nixli pu lumci lo kerfa	The girl washed her hair.
lo nobli zei traji zei turni cu turni lo gugde	The king governed the country.
lo notci be lo se lidne nu zei penmi cu se punji fi lo vorme zei gacri	A notice about the next meeting was posted on the door.
lo nu batci lo jgalu cu xlali tcaci	Biting your fingernails is a bad habit.
lo nu bilma cu fanta lo nu mi klama lo ckule	Illness prevented me from going to school.
lo nu carvi ca lo balvi zei lamji zei djedi cu cumki	Perhaps it will rain tomorrow.
lo nu carvi cu lakne	It will probably rain.
lo nu cecla zei xarci zei gasnu cu vu se tirna	A gunshot was heard in the distance.
lo nu ciksi lo ka ckape cu mutce vajni	To explain the risks is very important.
lo nu cilre fi le cnino bangu cu zdile	Learning a new language is fun.
lo nu cilre lo bangu mu'i lo nu jimpe ja cusku ku ku mutce frica lo nu cilre lo bangu mu'i lo nu zifre pilno pa'a lo verba zei cilre zei bangu	There is a big difference between learning a language in order to understand or to say something if needed, and wanting to acquire a second language in order to command it freely, almost like you command your first language, your mother tongue.
lo nu cilre lo fraso zei bangu cu nandu	French is difficult to learn.
lo nu cinba cu zdile	Kissing is fun.
lo nu citka kei cu pluka mi	Eating pleases me.
lo nu ckeji lo za'i na ka'e tavla fo lo bangu cu ve jimpe zei srera lo du'u ma kau bangu	Being ashamed of not speaking a language is a misunderstanding of what a language is.
lo nu co'e cu na bi'u sarcu	There's no need to do that now.
lo nu co'u pacna cu ro moi	Hope dies last.
lo nu co'u pacna cu ro moi fasnu	Hope dies last.
lo nu ctuca ku rinka lo nu farvi	Education is the agent of progress.
lo nu da kurji je to'e lazni cu sarcu gi'e nai ku'i banzu lo nu da snada le te cilre	Being careful and diligent is necessary, but not sufficient for passing this course.
lo nu da'i mi ciksi ro zo'e cu se ditcu lo cimni	It would take forever for me to explain everything.
lo nu danmo zei vasxu lo nu se feprkenra cu rinkra'a	There is a connection between smoking and lung cancer.
lo nu dansu cu to'e se curmi	Dancing is prohibited.
lo nu dansu cu zdile	Dancing is fun.
lo nu djuno cu se smuni lo nu djuno lo du'u nondjuno i la'e di'u smuni lo ka djuno	To know is to know that you know nothing. That is the meaning of true knowledge.
lo nu djuno fi vo'e na frili	To know oneself is not easy.
lo nu sidju zei cusku ko'a cu simsa lo nu tavla lo kliti zei bliku zei bitmu	Giving advice to him is like talking to a brick wall.
lo nu do ca co'e cu na sarcu	You don't need to do that now.
lo nu do co'e cu na bi'u sarcu	There's no need for you to do that now.
lo nu do cpacu lo liste be lo'i sarcu cabra ti cu se curmi	A list of required hardware is available here.
lo nu do danmo zei vasxu vi ku cu se curmi	You can smoke here.
lo nu do jai cfari cu sarcu	It is necessary for you to start now.
lo nu do jo'u la tom cu casnu ma cu sarcu	What do you and Tom need to talk about?
lo nu do na pilno zei kakne lo bi'u nai proga zo'u do ri ca dei ka'e -kib- zei cpacu	If you do not have this program, you can download it now.
lo nu do pinxe lo milxe glare ladru cu zabna rinka lo nu do sipna	Drinking warm milk will help you get to sleep.
lo nu do te cusku cu vajni	It's important that you hear this.
lo nu do zvati lo cabna zei djedi nu zei jmaji cu na sarcu	There's no need for you to attend today's meeting.
lo nu do zvati lo cabna zei djedi nu zei jmaji cu na sarcu	You don't have to go to today's meeting.
lo nu draci ku ti'u ma cfari	What time does the play begin?
lo nu fanva cu te'iselstati	Translation is a kind of special skill.
lo nu fanva le valsi cu nandu mutce	That word is very hard to translate.
lo nu jimpe fi lo sidbo be fi ra cu nandu	His theory is difficult to understand.
lo nu jimpe fi lo sidbo be fi ra cu nandu	It is difficult to understand his theory.
lo nu jmive ku pluka	Life is beautiful.
lo nu klama la okinauas fu lo vinji kei li xo cacra	How many hours does it take to go to Okinawa by plane?
lo nu ko klama lo zdani cu clira	Come home early.
lo nu ko'a cusku cu te facki lo ka nu tcica zei cusku	What he said turned out to be a lie.
lo nu ko'a mutce lo ka to'e citno na zunti lo nu tsali	Although he is very old, he is strong.
lo nu ko'a te cusku cu vajni	It's important that he hears this.
lo nu ko'a te cusku cu vajni	It's important that she hears this.
lo nu kucli cu rinka lo nu lo mlatu cu morsi	Curiosity killed the cat.
lo nu la tam dasni lo clite zei creka cu na cafne	Tom doesn't often wear a suit.
lo nu la tom te jinga cu na zei cumki	Tom is impossible to beat.
lo nu lerci fa lo nu da cikna zei binxo cu nibli lo nu lerci fa lo nu de cuntu da	If you are late in the morning, you will be late the whole day.
lo nu lo mlatu cu fagri kei cu nenri lo mi palku	There is a cat on fire in my pants!
lo nu lo pendo mi sidju pu cumki zei rinka lo nu mi snada	My friend helping me enabled me to succeed.
lo nu lo va verba cu xe muvdu cu pu cumki ca lo nu lo bevri zei marce mo'i ti'a muvdu	That kid was almost run over when the truck backed up.
lo nu mi bajra cu zmadu ro drata be vo'a lo ka mi prami	I love to jog more than anything else in the world.
lo nu mi bilma la influ,enzas kei cisti	I catch the flu every year.
lo nu mi ca'o tadni lo dikca zei nu zei saske zei zukte cu zvati le la plimyt banli zei ckule	I am studying electrical engineering at the University of Plymouth.
lo nu mi cliva cu curmi te ca'i lo te minde be fi lo nobli zei traji zei turni	I am permitted to leave, based on the command of the king.
lo nu mi djuno fi xo kau valsi cu manci	The number of words I know is amazing.
lo nu mi gasnu cu traji xlali	This is the worst thing I've ever done.
lo nu mi klama lo zdani cu xamgu da'i mi	I should go home.
lo nu mi lebna lo cukta cu se krinu lo nu mi viska cy	I take the book because I see it.
lo nu mi lebna lo cukta cu se krinu lo nu mi viska cy	My taking the book is justified by my seeing it.
lo nu mi na klama le zarci cu se krinu lo nu le karce cu spofu	My not going to the market is because the car is broken.
lo nu mi pu to'e rinsa da na na ka'e nai rinka lo nu mi na ba rinsa da	The fact that I said farewell to someone in the past doesn't necessarily mean I won't greet them in the future.
lo nu mi renvi cu to'e zdile	My life is boring.
lo nu mi snada zei kakne cu pu te sidju fi do	Thanks to your help, I could succeed.
lo nu mi te cusku cu vajni	It's important that I hear this.
lo nu mi'a pu cadzu cu minli li ji'i mu	We walked about five miles.
lo nu morji lo cmene be ra cu nandu	His name is very difficult to remember.
lo nu mutce co cusku se ra'a lo da sevzi cu ji'a ka'e tadji lo nu mipri lo da sevzi	To talk about oneself a great deal can also be a means of concealing oneself.
lo nu na djica cu du lo nu ponse	Not wanting is the same as having.
lo nu na gasnu kei lo nu na zei certu gasnu cu zmadu lo ka xamgu	It's better to do nothing than to do something poorly.
lo nu pacna cu ro moi lo co'u zasti	Hope dies last.
lo nu pinxe loi ckafi ku lo nu pinxe loi tcati ku pluka zei zmadu mi	I prefer drinking coffee to drinking tea.
lo nu pixra zei larcu zei finti cu ralju se nelci ko'a	Painting was the great love of his life.
lo nu prami ba turni	Love will prevail.
lo nu prami cu tcica	Love is a trick.
lo nu prami cu zmadu lo nu se prami kei lo ka pluka	There is more pleasure in loving than in being loved.
lo nu prami loi jibni zei xabju be ma'a cu se bilga ma'a	To love our neighbors is our duty.
lo nu prami na zasti	Love doesn't exist.
lo nu ra co'a cikna na clira	He does not get up early.
lo nu ra jdice ma kau pu spaji ro da	Her decision shocked everyone.
lo nu ra klama lo ckule ca lo purci zei lamji zei djedi cu lerci	He was late for school yesterday.
lo nu ra morji cu ranji ro zo'e	His memory will live forever.
lo nu ra smaji cu spaji mi	Her silence surprised me.
lo nu ra smaji cu spaji mi	His silence surprised me.
lo nu renvi na frili	Life isn't easy.
lo nu ro nanmu cu gleki cu na cumki	Not every man can be happy.
lo nu se bebna kei claxu jmive na tankomo lo ka prije kei lo ka jinvi	Who lives without folly is not so wise as he thinks.
lo nu se tumla zei skiji cu ckape	Skateboarding is dangerous.
lo nu sisku zei penmi ko'e ku frili ko'a	He had no difficulty in finding the place.
lo nu snuti cu jalge lo nu ko'a na zei viska zei kakne	The accident happened because they could not see clearly.
lo nu sonci cu jibri mi se ca'i lo jbama	Being a soldier is my job, where I have authority over bombs.
lo nu su'o da sidju pu dukse lo ka lerci	Help came too late.
lo nu sutra zei dukse cu na sarcu	There's no need to rush.
lo nu tadni lo baurnuludu na nandu	It's not difficult to learn Dutch.
lo nu te vecnu ku se gleki mi	Shopping makes me happy!
lo nu tirna lo zgike kei mi'a pluka	We enjoyed listening to the music.
lo nu troci cu xamgu	Trying is good.
lo nu tu'a do cfari cu sarcu	It is necessary for you to start now.
lo nu zbasu la rom na djedi li pa	Rome wasn't built in a day.
lo nu ze'a lo djedi mi ganse no nu do kibro jundi pu ckaji zei jibni lo ka rinka lo nu mi terpa	It almost scared me not to see you online for a whole day.
lo nu zgike cu ka'e se ciksi fo lo ka larcu lo ka cinmo zei gasnu se pi'o lo sance mixre	Music can be defined as the art of producing emotion by the combination of sounds.
lo nu zunti larcu	Trolling is a art.
lo nu zei fanva cu se tadni	Translation is a scholarly discipline.
lo nu zei jmive cu banli	Life is great.
lo nu zei jmive cu se pagbu ge lo zabna gi lo mabla	In life there are ups and downs.
lo nu zei jmive cu tordu zei mutce	Life is short.
lo nu zei speni lo nu zei speni zei sisti cu ralju krinu	Marriage is the main cause of all divorces.
lo pa merko zei rupnu cu dunli lo pa no no merko zei fepni	A dollar is equal to a hundred cents.
lo pa nanca cu du lo pa masti be li pa re	A year has twelve months.
lo pa po'o bangu no roi jai banzu	One language is never enough.
lo palku po mi cu nukni	My pants are magenta.
lo pa moi pu na xamgu zei traji	The first was not the best.
lo panje ku cokcu lo litki	A sponge absorbs liquids.
lo panra linji na kruca	Parallel lines do not intersect each other.
lo panzi be do cu nanla je'i nixli	Is your child a boy or a girl?
lo papri cu sutra jelca	Paper burns quickly.
lo pastu cu mutce mapti do lo ka se viska	The dress suits you very well.
lo pastu cu simlu lo ka banzu banli ku se pi'o do	The dress looks quite cool on you.
lo pastu pe mi je pe lo nu limna cu tagji se la'u li du'e	My swimsuit is too tight.
lo patfu be do cu clani zei se zei xadni	Your father is tall.
lo patfu be do cu sraji zei clani	Your father is tall.
lo patfu be ko'a pu se kenra binxo	His father became ill with cancer.
lo patfu be mi cu banli litru	My father is a great traveler.
lo patfu be mi cu cikre lo spofu stizu	My father fixed a broken chair.
lo patfu be mi cu mikce	My father is a doctor.
lo patfu be mi cu pante lo nu karce savru	My father complained about the traffic noise.
lo patfu be mi cu ralte pa karce poi mintu lo me la kimuras moi	My father has the same car as Mr Kimura's.
lo patfu be mi cu to'e cladu	My father is quiet.
lo patfu be mi ku kanro	My father is in good health.
lo patfu be mi ku na zvati lo zdani	My father isn't at home.
lo patfu be mi mi pendo mu'i lo du'u py dunda so'i se kelci mi	My father is my friend because he gives me a lot of toys.
lo patfu be mi na ba curmi	My father won't allow it.
lo patfu be mi na jimpe lo smuni be zo'ei mi	My father doesn't understand me.
lo patfu be mi na nelci lo fudbolo	My father doesn't like soccer.
lo patfu be mi na nelci lo zgike	My father does not like music.
lo patfu be mi na xebni do	My dad doesn't hate you.
lo patfu be ra cu morsi zei binxo ca lo pu zi jetfu	Her father passed away last week.
lo patfu be ra cu ponjo	Her father is Japanese.
lo patfu be ra cu ponjo	His father is Japanese.
lo patfu je lo bruna	Father and brother.
lo patfu po mi cuntu zei prenu	My father is a businessman.
lo patfu po mi mikce	My father is a doctor.
lo pa zei djedi cu pa moi djedi i lo re zei djedi cu re moi djedi i li'o	Monday is the first day, Tuesday is the second day, and so on.
lo pe do xirma cu melbi	Your horse is beautiful.
lo pe mi cnino mapku pei	How do you like my new hat?
lo pe mi jdini ba'o se zekri zei lebna	My money was stolen.
lo pe mi tuple cu ca'o sipna	My leg is still asleep.
lo pe mi xance fonxa cu spofu	My mobile phone is broken.
lo pendo be mi cu bebna	My friend is stupid.
lo pendo be mi pu klama la kanadas	My friend went to Canada.
lo pendo lo tarci cu simsa lo ka ro roi viska na je ku'i zasti	Good friends are like stars. You don't always see them, but you know they are always are there.
lo pi'ai mitre fei'u snidu cu gradu le so'i zei natmi zei gradu zei ciste lo ni muvdu zei sutra i le go'i cu se sinxa me'o my fi'u bu sy	The meter per second is the SI unit for velocity. Its symbol is m/s.
lo pilno lo stuzi be mi	Use my place.
lo pinpedi cu citka lo finpe	Seals eat fish.
lo pitsa cu me lo cukla zei cartu noi jarco lo nu pi xo kau vo'a cu stali	Pizza is a pie chart showing how much of it is left.
lo plise cu farlu fi lo tricu	An apple fell off the tree.
lo plise cu xamgu lo nu kanro i ji'a py kukte	Apples are good for your health, and, in addition, they taste great.
lo plise ku makcu	The apples are ripe.
lo pluka ko li'i djedi	Have a nice day.
lo pluka ko li'i sipna	Have a nice sleep!
lo pluta cu te zukte	The path is the goal.
lo ponjo cu xazdo	Japanese are Asians.
lo ponjo prenu cu clite	Japanese people in general are polite.
lo prenu be pa'a mi cu nitcu lo mapku	A man like me needs a hat.
lo prenu cu cizra	People are strange.
lo prenu cu da'i tirna lo nu do sanga ku na gi'a jinvi lo du'u do nixli	Hearing you sing, people might take you for a girl.
lo prenu cu frica lo danlu lo ka kakne lo nu pensi je cusku	Human beings are different from animals in that they can think and speak.
lo prenu ku krici lo du'u lo cevni ku zasti kei ku	People believe that god exists.
lo prenu pe bu'u le tcadu pu klama mu'i lo ka sidju le nakni	People in the town came to help him.
lo prenu poi ke'a catra la jyfykys cu te pleji fi la cy'ibu'abus	The person who shot JFK worked for the CIA.
lo prenu poi ko'a ca'o tavla ke'a me la alyn	The person she's talking to is Allan.
lo prenu poi lo ke'a speni cu morsi ku'o morsi zei speni	A man whose wife is dead is called a widower.
lo prenu ro roi te preti di'u mi	People ask me that all the time.
lo proletari cu ei cirko lo po'o linsi pe lo nei	The proletarians have nothing to lose but their chains.
lo pruxi po ra cu panpi surla di'ai	May his soul rest in peace.
lo pu jatna be la merko zei gugde cu du lo ro merko poi se slabu ro jatna be lo gugde	The former president of the United States is the only American who knows the president of every country.
lo pu nu la tom cu jukpa kei ja'a na'e xlali	Tom's cooking was actually not so bad.
lo pulji cu gunka fi'o se to'e snura lo nu morsi zei binxo	Policemen work at the risk of their own lives.
lo pulji pu klama	The police came.
